{
  "schema_version": "1.0.0",
  "task_id": "UI-002",
  "agent_id": "profile-ui",
  "branch": "lane/UI-002/profile-ui",
  "base_sha": "f578c28a7e3db506c0e8dbe06ca7e3e405cfea21",
  "lease_generation": 1,
  "state": "HEARTBEAT",
  "observed_at": "2026-07-27T02:18:20.666Z",
  "observed_head_sha": "b34d7289b0997ba299ef1118871f424af82b0c9c",
  "summary_code": "CHECKPOINT_VERIFIED",
  "next_action_code": "IMPLEMENT",
  "blocker_code": null
}
