{
  "schema_version": "1.0.0",
  "task_id": "FASHION-001",
  "agent_id": "fashion-contact-sheet",
  "branch": "lane/FASHION-001/fashion-contact-sheet",
  "base_sha": "f578c28a7e3db506c0e8dbe06ca7e3e405cfea21",
  "lease_generation": 1,
  "state": "HEARTBEAT",
  "observed_at": "2026-07-27T02:17:02.976Z",
  "observed_head_sha": "51ad26c00c1ab4d3c84e4d566112194ed2a622a8",
  "summary_code": "FOCUSED_PROOF_RUNNING",
  "next_action_code": "IMPLEMENT",
  "blocker_code": null
}
