{
  "schema_version": "1.0.0",
  "task_id": "MONITOR-002",
  "agent_id": "monitor-diagnostics",
  "branch": "lane/MONITOR-002/monitor-diagnostics",
  "base_sha": "5df0df404f3ed5ffb81d1c4490da57f042920bed",
  "lease_generation": 2,
  "state": "STARTED",
  "observed_at": "2026-07-27T09:00:41.000Z",
  "observed_head_sha": "7f742ce787a1f4075fc838242372760d376c985c",
  "summary_code": "WORK_STARTED",
  "next_action_code": "RUN_FOCUSED_PROOF",
  "blocker_code": null
}
